{
  "apiVersion": "gcac.compatibility/v2",
  "profileId": "windows-compatibility-iis",
  "version": "1.0",
  "baselineRef": "windows-compatibility-agent@1.0",
  "recipeRefs": [
    "certificate.deploy.windows-compatibility-iis@1.0"
  ],
  "certificationRefs": [
    "migration.windows-compatibility-iis.1.0"
  ],
  "declaredStatus": "experimental",
  "automation": "full",
  "limitations": [
    "仅支持 Windows Server 2008 R2 SP1 至 Windows Server 2012 R2 的独立兼容产品线",
    "Windows Server 2008 R2 SP1 + IIS 7.5 真实认证完成前不得提升为 certified",
    "必须通过前置检查声明的 .NET Framework 4.8、TLS 1.2、补丁、权限、证书存储和控制面连通性检查"
  ],
  "publishedAt": "2026-07-21T00:00:00.000Z"
}
