{
  "apiVersion": "gcac.compatibility/v2",
  "profileId": "linux-systemd-tomcat-pkcs12",
  "version": "1.0",
  "baselineRef": "linux-go-full-agent@1.0",
  "recipeRefs": [
    "certificate.deploy.linux-systemd-tomcat-pkcs12@1.0"
  ],
  "certificationRefs": [
    "migration.linux-systemd-tomcat-pkcs12.1.0"
  ],
  "declaredStatus": "experimental",
  "automation": "full",
  "limitations": [
    "仅覆盖预构建 PKCS12 密钥库原子替换，不在 Agent 内按 Tomcat/JDK 版本生成密钥库",
    "真实 Tomcat/JDK 环境认证完成前不得提升为 certified"
  ],
  "publishedAt": "2026-07-21T00:00:00.000Z"
}
